{
  "contract-version": "v1",
  "provider-id": "codex",
  "fetched-at": "2026-03-30T00:00:00Z",
  "source": "cli",
  "models": [
    {
      "model-id": "gpt-5.4-mini",
      "display-name": "GPT-5.4 Mini",
      "status": "active",
      "supports-structured-output": true,
      "context-window": 200000
    },
    {
      "model-id": "gpt-5.4",
      "display-name": "GPT-5.4",
      "status": "experimental",
      "supports-structured-output": true,
      "context-window": 200000
    }
  ]
}
